{
  "actors": [
    "agent:eval_reviewer_001",
    "human:alice",
    "tool:sol_executor"
  ],
  "artifact_id": "art_01j9x7k9k5m2c8v6h3p4q2r1s0",
  "cells": [
    {
      "cell_id": "cell_001",
      "cell_type": "sol:cell/prose",
      "summary": "Introduces the checkpoint comparison task."
    },
    {
      "cell_id": "cell_010",
      "cell_type": "sol:cell/config",
      "summary": "Defines evaluation thresholds."
    },
    {
      "cell_id": "cell_011",
      "cell_type": "sol:cell/data",
      "summary": "Binds the evaluation dataset."
    },
    {
      "cell_id": "cell_014",
      "cell_type": "sol:cell/code",
      "summary": "Computes loss, accuracy, and EOS rate for each checkpoint."
    },
    {
      "cell_id": "cell_015",
      "cell_type": "sol:cell/display",
      "summary": "Displays the current metrics table."
    },
    {
      "cell_id": "cell_016",
      "cell_type": "sol:cell/code",
      "summary": "Cell that fails after valid prefix."
    },
    {
      "cell_id": "cell_claim_anchor_007",
      "cell_type": "sol:cell/anchor",
      "summary": "Places claim_007 into the narrative."
    }
  ],
  "diagnostics": [],
  "execution_structure": {
    "branches": [
      {
        "base_commit": null,
        "branch_id": "branch_001",
        "created_by": "human:alice",
        "head_commit": "commit:commit_042",
        "name": "main",
        "purpose": "Primary integration branch."
      },
      {
        "base_commit": "commit:commit_042",
        "branch_id": "branch_007",
        "created_by": "human:alice",
        "head_commit": "commit:commit_043",
        "name": "strict_metric_threshold",
        "purpose": "Test whether stricter pass criteria change the selected checkpoint."
      }
    ],
    "cells": [
      "cell:cell_001",
      "cell:cell_010",
      "cell:cell_011",
      "cell:cell_014",
      "cell:cell_015",
      "cell:cell_claim_anchor_007",
      "cell:cell_016"
    ],
    "type": "linear"
  },
  "failures": [
    {
      "error_type": "ExampleError",
      "failed_cell": "cell:cell_016",
      "record_id": "failure_002",
      "run_id": "run:run_008",
      "status": {
        "lifecycle": "active",
        "staleness": "current",
        "verification": "unverified"
      }
    },
    {
      "error_type": "UnregisteredSource",
      "failed_cell": "cell:cell_016",
      "record_id": "failure_100",
      "run_id": "run:run_100",
      "status": {
        "lifecycle": "active",
        "staleness": "current",
        "verification": "unverified"
      }
    }
  ],
  "manifest": {
    "artifact_id": "art_01j9x7k9k5m2c8v6h3p4q2r1s0",
    "current_commit": "commit_100",
    "reproducibility_status": "partially_reproducible",
    "required_features": [
      "sol:feature/linear_execution",
      "sol:feature/internal_object_store",
      "sol:feature/machine_summary"
    ],
    "sol_version": "0.1"
  },
  "open_proposals": [],
  "records": [
    {
      "record_id": "claim_007",
      "record_type": "sol:record/claim",
      "status": {
        "lifecycle": "active",
        "staleness": "current",
        "verification": "verified"
      },
      "summary": "M200 has lower EOS hazard than M0 on open-ended prompts."
    },
    {
      "record_id": "decision_002",
      "record_type": "sol:record/decision",
      "status": {
        "lifecycle": "active",
        "staleness": "current",
        "verification": "unverified"
      },
      "summary": "Promote M200 for next-stage testing."
    },
    {
      "record_id": "evidence_011",
      "record_type": "sol:record/evidence",
      "status": {
        "lifecycle": "active",
        "staleness": "current",
        "verification": "unverified"
      },
      "summary": "Metrics table showing M200 has lower EOS rate."
    },
    {
      "record_id": "failure_002",
      "record_type": "sol:record/failure",
      "status": {
        "lifecycle": "active",
        "staleness": "current",
        "verification": "unverified"
      },
      "summary": "Execution failed before completion; see failure details."
    },
    {
      "record_id": "failure_100",
      "record_type": "sol:record/failure",
      "status": {
        "lifecycle": "active",
        "staleness": "current",
        "verification": "unverified"
      },
      "summary": "Execution failed at cell:cell_016; see failure details."
    },
    {
      "record_id": "task_001",
      "record_type": "sol:record/task",
      "status": {
        "lifecycle": "active",
        "staleness": "current",
        "verification": "unverified"
      },
      "summary": "Compare checkpoints M0, M200, and M2000."
    },
    {
      "record_id": "verification_005",
      "record_type": "sol:record/verification",
      "status": {
        "lifecycle": "active",
        "staleness": "current",
        "verification": "unverified"
      },
      "summary": "Reexecution verification of claim_007."
    }
  ],
  "render_id": "machine_summary",
  "renders": [
    {
      "render_id": "render_012",
      "source_commit": "commit:commit_042",
      "target": "html"
    }
  ],
  "runs": [
    {
      "result_commit": "commit:commit_042",
      "run_id": "run_008",
      "source_commit": "commit:commit_041",
      "status": "partial_success"
    },
    {
      "result_commit": null,
      "run_id": "run_012",
      "source_commit": "commit:commit_042",
      "status": "success"
    },
    {
      "result_commit": "commit:commit_100",
      "run_id": "run_100",
      "source_commit": "commit:commit_042",
      "status": "partial_success"
    }
  ],
  "sol_version": "0.1",
  "source_commit": "commit_100",
  "stale": [],
  "target": "machine_summary"
}